{
  "prompt": "Scene:\nA square plate or board viewed straight-on, with crisp organization, disciplined spacing, and premium print clarity. Build the frame around components separated clearly enough to reveal construction and dependency. Keep the lighting, camera distance, and spatial organization tuned for a high-signal research image rather than a casual snapshot. The image belongs to the Scientific Paper Figure theme and should feel immediately legible as a prompt atlas theme for scientific paper figure, testing physics-materials, commercial-mockup with gpt image 2..\n\nSubject:\nCenter the study on components separated clearly enough to reveal construction and dependency. Translate the theme into a concrete visual statement instead of an abstract mood board: the viewer should understand what kind of image this is, what is being tested, and why the composition is difficult. Use the slug idea of scientific paper figure as a literal guide for subject matter, materials, and staging. If helpful, borrow the broad visual cues suggested by Nature, Science, but keep the result original and specific to this study.\n\nImportant details:\nThe image should communicate logic through grouping, hierarchy, callouts, insets, and believable professional layout discipline rather than decorative noise. Preserve a disciplined square composition, clear focal hierarchy, and enough secondary information to make the image feel complete rather than underspecified. The image should look polished, novel, and exhibition-ready, with topic-specific credibility coming from the way surfaces, structure, and visual language reinforce Scientific Paper Figure. Avoid generic filler elements that do not serve the main concept.\n\nUse case:\nScientific Paper Figure single study 7/8, testing physics-materials, commercial-mockup through the exploded system variation.\n\nConstraints:\nNo readable text, no watermark, no logos, preserve exact 1:1 aspect ratio, no readable labels, no messy arrows, no random infographic decoration, no fake UI chrome unless the topic calls for it, no broken alignment, no meaningless clutter.",
  "id": "exploded-system",
  "title": "Exploded System",
  "description": "Exploded System interprets Scientific Paper Figure as a self-contained image study with a distinct visual emphasis.",
  "type": "single",
  "image": "image.png",
  "aspect_ratio": "1:1",
  "tags": [
    "single",
    "structured-layout",
    "technical-diagram",
    "scientific-realism"
  ],
  "refs": [],
  "status": "prompted",
  "generation": {
    "order": 7,
    "mode": "image",
    "model": "gpt-image-2",
    "output": {
      "path": "works/topics/scientific-paper-figure/packages/single-scientific-paper-figure-studies/images/exploded-system/image.png",
      "name": "image"
    },
    "depends_on": [],
    "ref_urls": [],
    "runner_notes": "Independent Scientific Paper Figure single-image study; no reference URL required."
  },
  "i18n": {
    "en": {
      "title": "Exploded System",
      "description": "Exploded System interprets Scientific Paper Figure as a self-contained image study with a distinct visual emphasis."
    },
    "zh-CN": {
      "title": "爆炸系统",
      "description": "爆炸系统：围绕 科学论文配图 的独立单图研究，强调该变体的关键视觉控制点。"
    }
  },
  "display": {
    "featured": false,
    "sort_order": 70,
    "audiences": [
      "gallery",
      "research"
    ],
    "tags": [
      "single",
      "structured-layout",
      "technical-diagram",
      "scientific-realism"
    ],
    "alt": {
      "en": "Exploded System for Scientific Paper Figure.",
      "zh-CN": "科学论文配图主题中的爆炸系统图像研究。"
    }
  }
}
