{
  "prompt": "Scene:\nA polished Prompt Atlas production image for the theme Mandala Precision Geometry. Build a finished, gallery-ready visual demonstration rather than a generic mood board. The setting should be specific, coherent, and immediately readable, with lighting, viewpoint, and environment chosen to support a more dramatic gallery variation.\n\nSubject:\nCreate gallery variant as a self-contained image that demonstrates Mandala Precision Geometry. The main subject should occupy the visual center of gravity, with clear supporting details around it. Use the theme's capability focus: recognizable real-world knowledge and cultural detail, optical-illusion geometry and precise perspective.\n\nImportant details:\nHigh production value, precise composition, clean hierarchy, crop-safe framing, and no unrelated filler. Make the visual evidence of the theme visible at thumbnail size and still rewarding in close inspection. Use believable materials, intentional color contrast, and consistent design language across all elements.\n\nUse case:\nIndependent single-image study in Prompt Atlas, intended for a gallery card and detail modal. It should prove the theme direction before deeper series production.\n\nConstraints:\nNo watermark, no real brand logo, no private data, no temporary URLs, no task ids, no messy extra panels, no unreadable clutter, no accidental duplicate main subjects, preserve exact 1:1 aspect ratio.",
  "id": "03-gallery-variant",
  "title": "Gallery Variant",
  "description": "Gallery Variant is an independent study for the Mandala Precision Geometry theme.",
  "type": "single",
  "image": "image.png",
  "aspect_ratio": "1:1",
  "tags": [
    "single",
    "world-knowledge",
    "optical-illusion"
  ],
  "refs": [],
  "status": "prompted",
  "generation": {
    "order": 3,
    "mode": "image",
    "model": "gpt-image-2",
    "output": {
      "path": "works/topics/mandala-precision-geometry/packages/single-theme-studies/images/03-gallery-variant/image.png",
      "name": "image"
    },
    "depends_on": [],
    "ref_urls": [],
    "runner_notes": "Independent prompted image; no reference URL required."
  },
  "i18n": {
    "en": {
      "title": "Gallery Variant",
      "description": "Gallery Variant is an independent study for the Mandala Precision Geometry theme."
    },
    "zh-CN": {
      "title": "Gallery Variant",
      "description": "Gallery Variant 是 曼荼罗 Mandala · 精密对称几何 主题的一张独立研究图。"
    }
  },
  "display": {
    "featured": false,
    "sort_order": 30,
    "audiences": [
      "gallery",
      "research"
    ],
    "tags": [
      "single",
      "world-knowledge",
      "optical-illusion"
    ],
    "alt": {
      "en": "Gallery Variant is an independent study for the Mandala Precision Geometry theme.",
      "zh-CN": "Gallery Variant 是 曼荼罗 Mandala · 精密对称几何 主题的一张独立研究图。"
    }
  }
}
