{
  "prompt": "Scene:\nA square material-focused image where lighting, scale, and surface behavior are the main event. Build the frame around the dominant material language shown with full confidence. Keep the lighting, camera distance, and spatial organization tuned for a high-signal research image rather than a casual snapshot. The image belongs to the Ancient Book Restoration theme and should feel immediately legible as a prompt atlas theme for ancient book restoration, testing world-knowledge, editing-workflow with gpt image 2..\n\nSubject:\nCenter the study on the dominant material language shown with full confidence. Translate the theme into a concrete visual statement instead of an abstract mood board: the viewer should understand what kind of image this is, what is being tested, and why the composition is difficult. Use the slug idea of ancient book restoration as a literal guide for subject matter, materials, and staging.\n\nImportant details:\nMicrostructure matters: refraction, fibers, scratches, pores, edge wear, translucency, and dust should all feel physically specific. Preserve a disciplined square composition, clear focal hierarchy, and enough secondary information to make the image feel complete rather than underspecified. The image should look polished, novel, and exhibition-ready, with topic-specific credibility coming from the way surfaces, structure, and visual language reinforce Ancient Book Restoration. Avoid generic filler elements that do not serve the main concept.\n\nUse case:\nAncient Book Restoration single study 1/8, testing world-knowledge, editing-workflow through the surface hero variation.\n\nConstraints:\nNo readable text, no watermark, no logos, preserve exact 1:1 aspect ratio, no generic stock macro, no broken scale cues, no plastic-looking texture when it should feel natural, no meaningless blur, no watermark, no fake labels.",
  "id": "surface-hero",
  "title": "Surface Hero",
  "description": "Surface Hero interprets Ancient Book Restoration as a self-contained image study with a distinct visual emphasis.",
  "type": "single",
  "image": "image.png",
  "aspect_ratio": "1:1",
  "tags": [
    "single",
    "photorealism",
    "physics-materials",
    "micro-texture"
  ],
  "refs": [],
  "status": "done",
  "generation": {
    "order": 1,
    "mode": "image",
    "model": "gpt-image-2",
    "output": {
      "path": "works/topics/ancient-book-restoration/packages/single-ancient-book-restoration-studies/images/surface-hero/image.png",
      "name": "image"
    },
    "depends_on": [],
    "ref_urls": [],
    "runner_notes": "Independent Ancient Book Restoration single-image study; no reference URL required."
  },
  "i18n": {
    "en": {
      "title": "Surface Hero",
      "description": "Surface Hero interprets Ancient Book Restoration as a self-contained image study with a distinct visual emphasis."
    },
    "zh-CN": {
      "title": "材质主图",
      "description": "材质主图：围绕 古籍复原 · 对照页 的独立单图研究，强调该变体的关键视觉控制点。"
    }
  },
  "display": {
    "featured": false,
    "sort_order": 10,
    "audiences": [
      "gallery",
      "research"
    ],
    "tags": [
      "single",
      "photorealism",
      "physics-materials",
      "micro-texture"
    ],
    "alt": {
      "en": "Surface Hero for Ancient Book Restoration.",
      "zh-CN": "古籍复原 · 对照页主题中的材质主图图像研究。"
    }
  }
}
