{
  "prompt": "Scene:\nA square fashion materials studio with a single fictional mannequin-like model pose repeated as a clean triptych, neutral background, soft side lighting, and precise garment detail.\n\nSubject:\nThe same fictional model identity and pose appears three times. The garment silhouette remains identical, but the material changes across the triptych: matte wool, glossy technical nylon, and soft satin. Face, hair, body, skin tone, height, and pose must stay consistent.\n\nImportant details:\nPhotorealistic fabric behavior, clear material differences, stable model identity, identical silhouette, consistent camera height, subtle shadows, and a professional lookbook layout without readable labels.\n\nUse case:\nIndependent virtual try-on study for testing material changes while preserving identity, pose, and garment silhouette.\n\nConstraints:\nExactly three views, same fictional model identity, same garment silhouette, only material changes, no readable text, no logos, no watermark, no extra people, no distorted anatomy, preserve exact 1:1 aspect ratio.",
  "id": "material-swap-mannequin",
  "title": "Material Swap Mannequin",
  "description": "The same fictional model and silhouette are shown with three different garment materials.",
  "type": "single",
  "image": "image.png",
  "aspect_ratio": "1:1",
  "tags": [
    "virtual-try-on",
    "identity-consistency",
    "fashion",
    "single"
  ],
  "refs": [],
  "status": "prompted",
  "generation": {
    "order": 2,
    "mode": "image",
    "model": "gpt-image-2",
    "output": {
      "path": "works/topics/virtual-try-on-identity-lock/packages/single-try-on-studies/images/material-swap-mannequin/image.png",
      "name": "image"
    },
    "depends_on": [],
    "ref_urls": [],
    "runner_notes": "Independent prompted image; no reference URL required."
  },
  "i18n": {
    "en": {
      "title": "Material Swap Mannequin",
      "description": "The same fictional model and silhouette are shown with three different garment materials."
    },
    "zh-CN": {
      "title": "材质替换模特",
      "description": "同一虚构模特和同一服装轮廓展示三种不同面料。"
    }
  },
  "display": {
    "featured": false,
    "sort_order": 20,
    "audiences": [
      "gallery",
      "research"
    ],
    "tags": [
      "virtual-try-on",
      "fashion"
    ],
    "alt": {
      "en": "A triptych showing the same fictional model with the same outfit in three materials.",
      "zh-CN": "三联图展示同一虚构模特穿同一轮廓的三种材质服装。"
    }
  }
}
