{
  "prompt": "Scene:\nA square photographic image with intentional lens choice, coherent light, and a subject that feels observed rather than merely decorated. Build the frame around a time-sensitive or kinetic phenomenon captured at the right instant. Keep the lighting, camera distance, and spatial organization tuned for a high-signal research image rather than a casual snapshot. The image belongs to the Audubon Specimen Atlas theme and should feel immediately legible as a prompt atlas theme for audubon specimen atlas, testing structured-layout, technical-diagram with gpt image 2..\n\nSubject:\nCenter the study on a time-sensitive or kinetic phenomenon captured at the right instant. Translate the theme into a concrete visual statement instead of an abstract mood board: the viewer should understand what kind of image this is, what is being tested, and why the composition is difficult. Use the slug idea of audubon specimen atlas as a literal guide for subject matter, materials, and staging. If helpful, borrow the broad visual cues suggested by John James Audubon, Maria Sibylla Merian, but keep the result original and specific to this study.\n\nImportant details:\nThe realism should come from timing, optics, and material response: atmosphere, contrast, depth, motion, and tiny physical cues all need to agree. Preserve a disciplined square composition, clear focal hierarchy, and enough secondary information to make the image feel complete rather than underspecified. The image should look polished, novel, and exhibition-ready, with topic-specific credibility coming from the way surfaces, structure, and visual language reinforce Audubon Specimen Atlas. Avoid generic filler elements that do not serve the main concept.\n\nUse case:\nAudubon Specimen Atlas single study 4/8, testing structured-layout, technical-diagram through the motion moment variation.\n\nConstraints:\nNo readable text, no watermark, no logos, preserve exact 1:1 aspect ratio, no watermark, no cheap HDR excess, no unreadable signage, no fake stock-photo posing, no compositing seams, no arbitrary lens flare.",
  "id": "motion-moment",
  "title": "Motion Moment",
  "description": "Motion Moment interprets Audubon Specimen Atlas as a self-contained image study with a distinct visual emphasis.",
  "type": "single",
  "image": "image.png",
  "aspect_ratio": "1:1",
  "tags": [
    "single",
    "photorealism",
    "scientific-realism",
    "frontier-creative-composition"
  ],
  "refs": [],
  "status": "done",
  "generation": {
    "order": 4,
    "mode": "image",
    "model": "gpt-image-2",
    "output": {
      "path": "works/topics/audubon-specimen-atlas/packages/single-audubon-specimen-studies/images/motion-moment/image.png",
      "name": "image"
    },
    "depends_on": [],
    "ref_urls": [],
    "runner_notes": "Independent Audubon Specimen Atlas single-image study; no reference URL required."
  },
  "i18n": {
    "en": {
      "title": "Motion Moment",
      "description": "Motion Moment interprets Audubon Specimen Atlas as a self-contained image study with a distinct visual emphasis."
    },
    "zh-CN": {
      "title": "动态瞬间",
      "description": "动态瞬间：围绕 Audubon 风生物图谱 · 昆虫 / 鸟类标本盒 的独立单图研究，强调该变体的关键视觉控制点。"
    }
  },
  "display": {
    "featured": false,
    "sort_order": 40,
    "audiences": [
      "gallery",
      "research"
    ],
    "tags": [
      "single",
      "photorealism",
      "scientific-realism",
      "frontier-creative-composition"
    ],
    "alt": {
      "en": "Motion Moment for Audubon Specimen Atlas.",
      "zh-CN": "Audubon 风生物图谱 · 昆虫 / 鸟类标本盒主题中的动态瞬间图像研究。"
    }
  }
}
