{
  "prompt": "Scene:\nA polished Prompt Atlas production image for the theme X-Ray Art Photography. Build a finished, gallery-ready visual demonstration rather than a generic mood board. The setting should be specific, coherent, and immediately readable, with lighting, viewpoint, and environment chosen to support a practical applied system.\n\nSubject:\nCreate applied system as a self-contained image that demonstrates X-Ray Art Photography. The main subject should occupy the visual center of gravity, with clear supporting details around it. Use the theme's capability focus: credible real-world light, texture, and camera behavior, controlled style language without losing structure, optical-illusion geometry and precise perspective.\n\nImportant details:\nHigh production value, precise composition, clean hierarchy, crop-safe framing, and no unrelated filler. Make the visual evidence of the theme visible at thumbnail size and still rewarding in close inspection. Use believable materials, intentional color contrast, and consistent design language across all elements.\n\nUse case:\nIndependent single-image study in Prompt Atlas, intended for a gallery card and detail modal. It should prove the theme direction before deeper series production.\n\nConstraints:\nNo watermark, no real brand logo, no private data, no temporary URLs, no task ids, no messy extra panels, no unreadable clutter, no accidental duplicate main subjects, preserve exact 16:9 aspect ratio.",
  "id": "02-applied-system",
  "title": "Applied System",
  "description": "Applied System is an independent study for the X-Ray Art Photography theme.",
  "type": "single",
  "image": "image.png",
  "aspect_ratio": "16:9",
  "tags": [
    "single",
    "photorealism",
    "style-transfer",
    "optical-illusion"
  ],
  "refs": [],
  "status": "prompted",
  "generation": {
    "order": 2,
    "mode": "image",
    "model": "gpt-image-2",
    "output": {
      "path": "works/topics/xray-art-photography/packages/single-theme-studies/images/02-applied-system/image.png",
      "name": "image"
    },
    "depends_on": [],
    "ref_urls": [],
    "runner_notes": "Independent prompted image; no reference URL required."
  },
  "i18n": {
    "en": {
      "title": "Applied System",
      "description": "Applied System is an independent study for the X-Ray Art Photography theme."
    },
    "zh-CN": {
      "title": "Applied System",
      "description": "Applied System 是 X 光艺术摄影 · Nick Veasey 风 主题的一张独立研究图。"
    }
  },
  "display": {
    "featured": false,
    "sort_order": 20,
    "audiences": [
      "gallery",
      "research"
    ],
    "tags": [
      "single",
      "photorealism",
      "style-transfer",
      "optical-illusion"
    ],
    "alt": {
      "en": "Applied System is an independent study for the X-Ray Art Photography theme.",
      "zh-CN": "Applied System 是 X 光艺术摄影 · Nick Veasey 风 主题的一张独立研究图。"
    }
  }
}
