{
  "prompt": "Scene:\nA square photographic image with intentional lens choice, coherent light, and a subject that feels observed rather than merely decorated. Build the frame around a dusk, night, or low-light frame with disciplined exposure. Keep the lighting, camera distance, and spatial organization tuned for a high-signal research image rather than a casual snapshot. The image belongs to the X-Ray Art Photography theme and should feel immediately legible as a prompt atlas theme for x-ray art photography, testing photorealism, style-transfer, optical-illusion-geometry with gpt image 2..\n\nSubject:\nCenter the study on a dusk, night, or low-light frame with disciplined exposure. Translate the theme into a concrete visual statement instead of an abstract mood board: the viewer should understand what kind of image this is, what is being tested, and why the composition is difficult. Use the slug idea of xray art photography as a literal guide for subject matter, materials, and staging. If helpful, borrow the broad visual cues suggested by iPhone, but keep the result original and specific to this study.\n\nImportant details:\nThe realism should come from timing, optics, and material response: atmosphere, contrast, depth, motion, and tiny physical cues all need to agree. Preserve a disciplined square composition, clear focal hierarchy, and enough secondary information to make the image feel complete rather than underspecified. The image should look polished, novel, and exhibition-ready, with topic-specific credibility coming from the way surfaces, structure, and visual language reinforce X-Ray Art Photography. Avoid generic filler elements that do not serve the main concept.\n\nUse case:\nX-Ray Art Photography single study 5/8, testing photorealism, style-transfer, optical-illusion-geometry through the low-light atlas variation.\n\nConstraints:\nNo readable text, no watermark, no logos, preserve exact 1:1 aspect ratio, no watermark, no cheap HDR excess, no unreadable signage, no fake stock-photo posing, no compositing seams, no arbitrary lens flare.",
  "id": "low-light-atlas",
  "title": "Low-Light Atlas",
  "description": "Low-Light Atlas interprets X-Ray Art Photography as a self-contained image study with a distinct visual emphasis.",
  "type": "single",
  "image": "image.png",
  "aspect_ratio": "1:1",
  "tags": [
    "single",
    "photorealism",
    "scientific-realism",
    "frontier-creative-composition"
  ],
  "refs": [],
  "status": "done",
  "generation": {
    "order": 5,
    "mode": "image",
    "model": "gpt-image-2",
    "output": {
      "path": "works/topics/xray-art-photography/packages/single-xray-art-photography-studies/images/low-light-atlas/image.png",
      "name": "image"
    },
    "depends_on": [],
    "ref_urls": [],
    "runner_notes": "Independent X-Ray Art Photography single-image study; no reference URL required."
  },
  "i18n": {
    "en": {
      "title": "Low-Light Atlas",
      "description": "Low-Light Atlas interprets X-Ray Art Photography as a self-contained image study with a distinct visual emphasis."
    },
    "zh-CN": {
      "title": "低照图谱",
      "description": "低照图谱：围绕 X 光艺术摄影 · Nick Veasey 风 的独立单图研究，强调该变体的关键视觉控制点。"
    }
  },
  "display": {
    "featured": false,
    "sort_order": 50,
    "audiences": [
      "gallery",
      "research"
    ],
    "tags": [
      "single",
      "photorealism",
      "scientific-realism",
      "frontier-creative-composition"
    ],
    "alt": {
      "en": "Low-Light Atlas for X-Ray Art Photography.",
      "zh-CN": "X 光艺术摄影 · Nick Veasey 风主题中的低照图谱图像研究。"
    }
  }
}
