{
  "prompt": "Scene:\nA square commercial presentation with realistic materials, clean staging, and believable product photography or retail lighting. Build the frame around the strongest single commercial frame for the topic. Keep the lighting, camera distance, and spatial organization tuned for a high-signal research image rather than a casual snapshot. The image belongs to the Brand Identity Mockup Set theme and should feel immediately legible as a prompt atlas theme for brand identity mockup set, testing text-rendering, structured-layout, commercial-mockup with gpt image 2..\n\nSubject:\nCenter the study on the strongest single commercial frame for the topic. Translate the theme into a concrete visual statement instead of an abstract mood board: the viewer should understand what kind of image this is, what is being tested, and why the composition is difficult. Use the slug idea of brand identity mockup set as a literal guide for subject matter, materials, and staging. If helpful, borrow the broad visual cues suggested by logo, but keep the result original and specific to this study.\n\nImportant details:\nThe mockup should feel saleable and design-ready: sharp edges, controlled reflections, credible paper or plastic behavior, and precise placement. Preserve a disciplined square composition, clear focal hierarchy, and enough secondary information to make the image feel complete rather than underspecified. The image should look polished, novel, and exhibition-ready, with topic-specific credibility coming from the way surfaces, structure, and visual language reinforce Brand Identity Mockup Set. Avoid generic filler elements that do not serve the main concept.\n\nUse case:\nBrand Identity Mockup Set single study 8/8, testing text-rendering, structured-layout, commercial-mockup through the signature mockup variation.\n\nConstraints:\nNo readable text, no watermark, no logos, preserve exact 1:1 aspect ratio, no real brand names, no cheap stock-photo styling, no broken perspective, no watermark, no accidental readable packaging copy, no cluttered retail shelf unless intended.",
  "id": "signature-mockup",
  "title": "Signature Mockup",
  "description": "Signature Mockup interprets Brand Identity Mockup Set as a self-contained image study with a distinct visual emphasis.",
  "type": "single",
  "image": "image.png",
  "aspect_ratio": "1:1",
  "tags": [
    "single",
    "commercial-mockup",
    "structured-layout",
    "photorealism"
  ],
  "refs": [],
  "status": "done",
  "generation": {
    "order": 8,
    "mode": "image",
    "model": "gpt-image-2",
    "output": {
      "path": "works/topics/brand-identity-mockup-set/packages/single-brand-identity-mockup-set-studies/images/signature-mockup/image.png",
      "name": "image"
    },
    "depends_on": [],
    "ref_urls": [],
    "runner_notes": "Independent Brand Identity Mockup Set single-image study; no reference URL required."
  },
  "i18n": {
    "en": {
      "title": "Signature Mockup",
      "description": "Signature Mockup interprets Brand Identity Mockup Set as a self-contained image study with a distinct visual emphasis."
    },
    "zh-CN": {
      "title": "代表样机",
      "description": "代表样机：围绕 品牌 Identity 全套 mockup 的独立单图研究，强调该变体的关键视觉控制点。"
    }
  },
  "display": {
    "featured": false,
    "sort_order": 80,
    "audiences": [
      "gallery",
      "research"
    ],
    "tags": [
      "single",
      "commercial-mockup",
      "structured-layout",
      "photorealism"
    ],
    "alt": {
      "en": "Signature Mockup for Brand Identity Mockup Set.",
      "zh-CN": "品牌 Identity 全套 mockup主题中的代表样机图像研究。"
    }
  }
}
